{
  "schema_version": "CredentialDeliveryInteropV1",
  "clearance": {
    "clearance_id": "clr_a1b2c3d4",
    "clearance_digest": "aaaaaaaaaaaaaaaaaaaaaaaaaaaaaaaaaaaaaaaaaaaaaaaaaaaaaaaaaaaaaaaa"
  },
  "action": {
    "action_ref": "act_0001",
    "payload_digest": "bbbbbbbbbbbbbbbbbbbbbbbbbbbbbbbbbbbbbbbbbbbbbbbbbbbbbbbbbbbbbbbb"
  },
  "workload_ref": "workload:ingest-batch",
  "target_ref": "target:vault:user-profile",
  "possession": {
    "confirmation_key_thumbprint": "cccccccccccccccccccccccccccccccccccccccccccccccccccccccccccccccc"
  },
  "principal_id": "alice",
  "executor_id": "exec-1",
  "purpose_ref": "purpose:data-access",
  "issued_at": "2026-08-21T00:00:00Z",
  "expires_at": "2026-08-21T01:00:00Z",
  "nonce": "0123456789abcdef0123456789abcdef",
  "scope_narrowing": {
    "narrowed_resource_scope": "target:vault:user-profile:read"
  },
  "receipt_requirements": {
    "usage_receipt_required": true,
    "execution_receipt_required": true
  }
}